{
  "schemaVersion": 1,
  "band": {
    "id": "velvet-meridian",
    "name": "Velvet Meridian",
    "color": null
  },
  "source": {
    "url": "https://example.com/velvet-meridian/tour",
    "retrievedAt": "2026-10-14"
  },
  "shows": [
    {
      "id": "velvet-meridian-2027-01-15-tokyo",
      "date": "2027-01-15",
      "endDate": null,
      "startTime": "20:00",
      "tourName": "Pacific Rim Run 2027",
      "eventName": null,
      "venue": "Shibuya Quattro East",
      "city": "Tokyo",
      "region": null,
      "countryCode": "JP",
      "status": "scheduled",
      "ticketUrl": "https://tickets.example.org/velvet-meridian/2027-01-15",
      "sourceUrl": "https://example.com/velvet-meridian/tour",
      "notes": null,
      "geo": {
        "lat": 35.6762,
        "lon": 139.6503,
        "precision": "city",
        "source": "manual"
      }
    },
    {
      "id": "velvet-meridian-2027-01-16-tokyo",
      "date": "2027-01-16",
      "endDate": null,
      "startTime": "18:00",
      "tourName": "Pacific Rim Run 2027",
      "eventName": null,
      "venue": "Shibuya Quattro East",
      "city": "Tokyo",
      "region": null,
      "countryCode": "JP",
      "status": "soldout",
      "ticketUrl": "https://tickets.example.org/velvet-meridian/2027-01-16",
      "sourceUrl": "https://example.com/velvet-meridian/tour",
      "notes": null,
      "geo": {
        "lat": 35.6762,
        "lon": 139.6503,
        "precision": "city",
        "source": "manual"
      }
    },
    {
      "id": "velvet-meridian-2027-01-18-osaka",
      "date": "2027-01-18",
      "endDate": null,
      "startTime": "20:00",
      "tourName": "Pacific Rim Run 2027",
      "eventName": null,
      "venue": "Namba Hatch Two",
      "city": "Osaka",
      "region": null,
      "countryCode": "JP",
      "status": "scheduled",
      "ticketUrl": "https://tickets.example.org/velvet-meridian/2027-01-18",
      "sourceUrl": "https://example.com/velvet-meridian/tour",
      "notes": null,
      "geo": {
        "lat": 34.6937,
        "lon": 135.5023,
        "precision": "city",
        "source": "manual"
      }
    },
    {
      "id": "velvet-meridian-2027-01-20-seoul",
      "date": "2027-01-20",
      "endDate": null,
      "startTime": "20:00",
      "tourName": "Pacific Rim Run 2027",
      "eventName": null,
      "venue": "Rolling Hall B",
      "city": "Seoul",
      "region": null,
      "countryCode": "KR",
      "status": "scheduled",
      "ticketUrl": "https://tickets.example.org/velvet-meridian/2027-01-20",
      "sourceUrl": "https://example.com/velvet-meridian/tour",
      "notes": null,
      "geo": {
        "lat": 37.5665,
        "lon": 126.978,
        "precision": "city",
        "source": "manual"
      }
    },
    {
      "id": "velvet-meridian-2027-01-23-brisbane",
      "date": "2027-01-23",
      "endDate": null,
      "startTime": "20:00",
      "tourName": "Pacific Rim Run 2027",
      "eventName": null,
      "venue": "The Triffid Shed",
      "city": "Brisbane",
      "region": null,
      "countryCode": "AU",
      "status": "scheduled",
      "ticketUrl": "https://tickets.example.org/velvet-meridian/2027-01-23",
      "sourceUrl": "https://example.com/velvet-meridian/tour",
      "notes": null,
      "geo": {
        "lat": -27.4698,
        "lon": 153.0251,
        "precision": "city",
        "source": "manual"
      }
    },
    {
      "id": "velvet-meridian-2027-01-25-sydney",
      "date": "2027-01-25",
      "endDate": null,
      "startTime": "20:00",
      "tourName": "Pacific Rim Run 2027",
      "eventName": null,
      "venue": "Metro Basement",
      "city": "Sydney",
      "region": null,
      "countryCode": "AU",
      "status": "scheduled",
      "ticketUrl": "https://tickets.example.org/velvet-meridian/2027-01-25",
      "sourceUrl": "https://example.com/velvet-meridian/tour",
      "notes": null,
      "geo": {
        "lat": -33.8688,
        "lon": 151.2093,
        "precision": "city",
        "source": "manual"
      }
    },
    {
      "id": "velvet-meridian-2027-01-26-melbourne",
      "date": "2027-01-26",
      "endDate": null,
      "startTime": "20:00",
      "tourName": "Pacific Rim Run 2027",
      "eventName": null,
      "venue": "Corner Hall",
      "city": "Melbourne",
      "region": null,
      "countryCode": "AU",
      "status": "scheduled",
      "ticketUrl": "https://tickets.example.org/velvet-meridian/2027-01-26",
      "sourceUrl": "https://example.com/velvet-meridian/tour",
      "notes": null,
      "geo": {
        "lat": -37.8136,
        "lon": 144.9631,
        "precision": "city",
        "source": "manual"
      }
    },
    {
      "id": "velvet-meridian-2027-01-29-auckland",
      "date": "2027-01-29",
      "endDate": null,
      "startTime": "20:00",
      "tourName": "Pacific Rim Run 2027",
      "eventName": null,
      "venue": "Powerstation Lane",
      "city": "Auckland",
      "region": null,
      "countryCode": "NZ",
      "status": "scheduled",
      "ticketUrl": "https://tickets.example.org/velvet-meridian/2027-01-29",
      "sourceUrl": "https://example.com/velvet-meridian/tour",
      "notes": null,
      "geo": {
        "lat": -36.8485,
        "lon": 174.7633,
        "precision": "city",
        "source": "manual"
      }
    },
    {
      "id": "velvet-meridian-2027-01-30-wellington",
      "date": "2027-01-30",
      "endDate": null,
      "startTime": null,
      "tourName": "Pacific Rim Run 2027",
      "eventName": null,
      "venue": "San Fran Upstairs",
      "city": "Wellington",
      "region": null,
      "countryCode": "NZ",
      "status": "scheduled",
      "ticketUrl": "https://tickets.example.org/velvet-meridian/2027-01-30",
      "sourceUrl": "https://example.com/velvet-meridian/tour",
      "notes": null,
      "geo": {
        "lat": -41.2865,
        "lon": 174.7762,
        "precision": "city",
        "source": "manual"
      }
    },
    {
      "id": "velvet-meridian-2027-02-02-honolulu",
      "date": "2027-02-02",
      "endDate": null,
      "startTime": "20:00",
      "tourName": "Pacific Rim Run 2027",
      "eventName": null,
      "venue": "Hawaiian Brian’s Loft",
      "city": "Honolulu",
      "region": "HI",
      "countryCode": "US",
      "status": "scheduled",
      "ticketUrl": "https://tickets.example.org/velvet-meridian/2027-02-02",
      "sourceUrl": "https://example.com/velvet-meridian/tour",
      "notes": null,
      "geo": {
        "lat": 21.3099,
        "lon": -157.8581,
        "precision": "city",
        "source": "manual"
      }
    },
    {
      "id": "velvet-meridian-2027-02-05-san-francisco",
      "date": "2027-02-05",
      "endDate": null,
      "startTime": "20:00",
      "tourName": "Pacific Rim Run 2027",
      "eventName": null,
      "venue": "The Chapel Annex",
      "city": "San Francisco",
      "region": "CA",
      "countryCode": "US",
      "status": "scheduled",
      "ticketUrl": "https://tickets.example.org/velvet-meridian/2027-02-05",
      "sourceUrl": "https://example.com/velvet-meridian/tour",
      "notes": null,
      "geo": {
        "lat": 37.7749,
        "lon": -122.4194,
        "precision": "city",
        "source": "manual"
      }
    },
    {
      "id": "velvet-meridian-2027-02-06-los-angeles",
      "date": "2027-02-06",
      "endDate": null,
      "startTime": "20:00",
      "tourName": "Pacific Rim Run 2027",
      "eventName": null,
      "venue": "Lodge Room East",
      "city": "Los Angeles",
      "region": "CA",
      "countryCode": "US",
      "status": "scheduled",
      "ticketUrl": "https://tickets.example.org/velvet-meridian/2027-02-06",
      "sourceUrl": "https://example.com/velvet-meridian/tour",
      "notes": null,
      "geo": {
        "lat": 34.0522,
        "lon": -118.2437,
        "precision": "city",
        "source": "manual"
      }
    },
    {
      "id": "velvet-meridian-2027-02-09-seattle",
      "date": "2027-02-09",
      "endDate": null,
      "startTime": "20:00",
      "tourName": "Pacific Rim Run 2027",
      "eventName": null,
      "venue": "Neumos Back Bar",
      "city": "Seattle",
      "region": "WA",
      "countryCode": "US",
      "status": "scheduled",
      "ticketUrl": "https://tickets.example.org/velvet-meridian/2027-02-09",
      "sourceUrl": "https://example.com/velvet-meridian/tour",
      "notes": null,
      "geo": {
        "lat": 47.6062,
        "lon": -122.3321,
        "precision": "city",
        "source": "manual"
      }
    },
    {
      "id": "velvet-meridian-2027-02-10-vancouver",
      "date": "2027-02-10",
      "endDate": null,
      "startTime": "20:00",
      "tourName": "Pacific Rim Run 2027",
      "eventName": null,
      "venue": "Rickshaw Hall",
      "city": "Vancouver",
      "region": "BC",
      "countryCode": "CA",
      "status": "scheduled",
      "ticketUrl": "https://tickets.example.org/velvet-meridian/2027-02-10",
      "sourceUrl": "https://example.com/velvet-meridian/tour",
      "notes": null,
      "geo": {
        "lat": 49.2827,
        "lon": -123.1207,
        "precision": "city",
        "source": "manual"
      }
    },
    {
      "id": "velvet-meridian-2027-02-13-anchorage",
      "date": "2027-02-13",
      "endDate": null,
      "startTime": "20:00",
      "tourName": "Pacific Rim Run 2027",
      "eventName": null,
      "venue": "Williwaw Stage",
      "city": "Anchorage",
      "region": "AK",
      "countryCode": "US",
      "status": "cancelled",
      "ticketUrl": "https://tickets.example.org/velvet-meridian/2027-02-13",
      "sourceUrl": "https://example.com/velvet-meridian/tour",
      "notes": null,
      "geo": {
        "lat": 61.2181,
        "lon": -149.9003,
        "precision": "city",
        "source": "manual"
      }
    }
  ]
}
