{
  "schemaVersion": 1,
  "band": {
    "id": "ashen-choir",
    "name": "Ashen Choir",
    "color": null
  },
  "source": {
    "url": "https://example.com/ashen-choir/tour",
    "retrievedAt": "2026-10-16"
  },
  "shows": [
    {
      "id": null,
      "date": "2027-03-04",
      "endDate": null,
      "startTime": "20:00",
      "tourName": "Cinder Hymns Tour",
      "eventName": null,
      "venue": "Tavastia Klubi",
      "city": "Helsinki",
      "region": null,
      "countryCode": "FI",
      "status": "scheduled",
      "ticketUrl": "https://tickets.example.org/ashen-choir/2027-03-04",
      "sourceUrl": "https://example.com/ashen-choir/tour",
      "notes": null,
      "geo": null
    },
    {
      "id": null,
      "date": "2027-03-06",
      "endDate": null,
      "startTime": null,
      "tourName": "Cinder Hymns Tour",
      "eventName": null,
      "venue": null,
      "city": "Tallinn",
      "region": null,
      "countryCode": "EE",
      "status": "scheduled",
      "ticketUrl": "https://tickets.example.org/ashen-choir/2027-03-06",
      "sourceUrl": "https://example.com/ashen-choir/tour",
      "notes": null,
      "geo": null
    },
    {
      "id": null,
      "date": "2027-03-08",
      "endDate": null,
      "startTime": "20:00",
      "tourName": "Cinder Hymns Tour",
      "eventName": null,
      "venue": null,
      "city": "Rīga",
      "region": null,
      "countryCode": "LV",
      "status": "scheduled",
      "ticketUrl": "https://tickets.example.org/ashen-choir/2027-03-08",
      "sourceUrl": "https://example.com/ashen-choir/tour",
      "notes": null,
      "geo": null
    },
    {
      "id": null,
      "date": "2027-03-10",
      "endDate": null,
      "startTime": "20:00",
      "tourName": "Cinder Hymns Tour",
      "eventName": null,
      "venue": null,
      "city": "Vilnius",
      "region": null,
      "countryCode": "LT",
      "status": "scheduled",
      "ticketUrl": "https://tickets.example.org/ashen-choir/2027-03-10",
      "sourceUrl": "https://example.com/ashen-choir/tour",
      "notes": null,
      "geo": null
    },
    {
      "id": null,
      "date": "2027-03-12",
      "endDate": null,
      "startTime": "20:00",
      "tourName": "Cinder Hymns Tour",
      "eventName": null,
      "venue": null,
      "city": "Gdańsk",
      "region": null,
      "countryCode": "PL",
      "status": "scheduled",
      "ticketUrl": "https://tickets.example.org/ashen-choir/2027-03-12",
      "sourceUrl": "https://example.com/ashen-choir/tour",
      "notes": null,
      "geo": null
    },
    {
      "id": null,
      "date": "2027-03-14",
      "endDate": null,
      "startTime": "20:00",
      "tourName": "Cinder Hymns Tour",
      "eventName": null,
      "venue": null,
      "city": "Düsseldorf",
      "region": null,
      "countryCode": "DE",
      "status": "scheduled",
      "ticketUrl": "https://tickets.example.org/ashen-choir/2027-03-14",
      "sourceUrl": "https://example.com/ashen-choir/tour",
      "notes": null,
      "geo": null
    }
  ]
}
